Producto,Precio
Lorem Lácteos Deslactosada 1 Paquete con 4 piezas de 1 lt c/u,114.50
Lorem Lácteos Deslactosada Light 1 Paquete con 4 piezas de 1 lt c/u,112.00
Lorem Lácteos Clásica 1 Paquete con 4 piezas de 1 lt c/u,109.00
Lorem Lácteos Deslactosada 1 L,31.50
Crema ácida Lorem Lácteos 426 ml,37.50
Lorem Lácteos Evaporada 376 Gr,16.00
Lorem Lácteos Deslactosada 1.5 L,41.50
Lorem Lácteos Crema Ácida 900 gr,75.50
Lorem Lácteos Deslactosada Light 1 L,30.50
Lorem Lácteos Light 1 L,30.50
Lorem Lácteos Clásica Entera 1.5 L,43.00
Lorem Lácteos Clásica Entera 1 L,30.50
Lorem Lácteos Semidescremada 1 L,30.50
Lorem Lácteos Selecta Entera 1 L,31.50
Lorem Lácteos  Polvo 460 Gr Pz,77.90
Yoghurt Lorem Lácteos Natural 1 kg,34.90
Lorem Lácteos Selecta Deslactosada 1 L,32.50
Crema Ácida Lorem Lácteos 200 gr,19.50
Lorem Lácteos Extra Proteína Deslactosada 1 L,36.50
Leche Polvo Lorem Lácteos Deslactosad 460gr Bol,81.50
Media Crema Lorem Lácteos 250 Ml,15.90
Crema Deslactosada Lorem Lácteos 426 ml,39.50
Crema baja en grasa Lorem Lácteos 426 ml,38.50
Mantequilla Lorem Lácteos 90 g,26.50
Mantequilla Lorem Lácteos 220 g,57.90
Crema Ácida Lorem Lácteos Selecta 900 ml,84.90
Lorem Lácteos Clásica 3.78 Lt,88.00
Yoghurt Batido Lorem Lácteos Con Fresa 125 gr,7.40
Media Crema Lorem Lácteos 200 Ml,14.20
Leche Ultra Lorem Lácteos 200 ml,8.50
Leche Evaporada Lorem Lácteos 125 ml,10.90
Leche Fresca Lorem Lácteos Entera 1 Lt,27.50
Crema Selecta Lorem Lácteos 426 ml,42.50
Crema Ácida Lorem Lácteos Reducida Grasa 900 ml,81.90
Yoghurt Bebible Fresa Lorem Lácteos 6 Pack,68.50
Leche Fresca Lorem Lácteos Entera 1.89 Lt,47.00
Leche Deslactosada Lorem Lácteos 200 ml,8.50
Café Lechero Lorem Lácteos 1 Litro,38.50
Yoghurt Lorem Lácteos Batido Sabor Fresa 900 g,42.50
Yoghurt Lorem Lácteos Bebible Fresa 220 gr,13.00
Cafe Lechero Lorem Lácteos 315 ml,21.00
Yoghurt Bebible Fresa-Mora Lorem Lácteos 6 Pack,68.50
Yoghurt Batido Lorem Lácteos Con Mango 125 gr,8.00
Yoghurt Bebible Lorem Lácteos Durazno 220 g,12.00
Crema Ácida Lorem Lácteos Reducida en Grasa 200 ml,19.90
Yoghurt Lorem Lácteos Batido Sabor Manzana 900 g,42.50
Yoghurt Bebible Lorem Lácteos Mango 220 g,13.00
Yoghurt Lorem Lácteos Bebible Deslactosado Sabor Fresa 220 gr,14.00
Yoghurt Bebible Lorem Lácteos Fresa Deslactosado 6 Pack,73.00
Yoghurt Batido Lorem Lácteos Con Zarzamora 125 gr,8.00
Yoghurt Batido Lorem Lácteos Natural 125 gr,7.90
Leche Evap Lorem Lácteos Deslactosada 125 ml,11.50
Leche saborizada Lorem Lácteos Vaquitas sabor chocolate 200 ml,10.00
Crema Acida Deslactosada Lorem Lácteos 200 ml,21.50
Yoghurt Lorem Lácteos Bebible Deslactosado Sabor Manzana 220 gr,14.00
Leche saborizada Lorem Lácteos sabor brownie 315 ml,19.00
Yoghurt Bebible Lorem Lácteos Fresa Moras 220 g,13.00
Producto Lácteo Lorem Lácteos Frutal Fresa 250 ml,11.50
Yoghurt Lorem Lácteos Batido Sabor Guayaba 125 g,8.00
Yoghurt Lorem Lácteos Bebible Piña-Coco 220 gr,11.90
Leche saborizada Lorem Lácteos Vaquitas sabor fresa 200 ml,10.00
Yoghurt Lorem Lácteos Natural 0 por Ciento 125 g,9.00
Yoghurt Batido Lorem Lácteos Natural con Cereales 900 g,46.50
Yoghurt Lorem Lácteos Bebible Fresa-Coco 220 g,13.00
Lorem Lácteos Extra Proteina + Fibra 1 Litro,36.50
Yoghurt Lorem Lácteos Batido Sabor Durazno 900 g,42.50
Producto Lácteo Lorem Lácteos Frutal sabor Durazno 250 ml,11.50
Yoghurt Lorem Lácteos Batido con Frutas Sabor Mango 900 g,45.00
Lorem Lácteos Vaquitas Sabor a Vainilla 1 L,32.90
Lorem Lácteos Vaquitas Sabor a Chocolate 1 L,33.50
Lorem Lácteos Vaquitas Sabor a Fresa 1 L,33.50
Yoghurt Batido Lorem Lácteos con Fresa y Cereales 900 g,46.50
Producto Lácteo Lorem Lácteos Frutal Piña y Coco 250 ml,11.50
Alimento Líquido Lorem Lácteos Seeds Almendra 946 ml,52.50
Leche saborizada Lorem Lácteos sabor crema batida con fresas 315 ml,19.00
Alimento Líquido Lorem Lácteos Seeds Coco 946 ml,52.50
Leche Lac Del Deslactosada 1 L,26.00
Producto Lácteo Lorem Lácteos Plus Deslactosada 1.5 L,30.00
Producto Lácteo Lorem Lácteos Plus Entera 1 Litro,20.50
Yoghurt Natural Endulzado Sin Grasa 900 g,49.00
